"name","description","category","brand","price","quantity","images","compatibility","type","subcategory","numberoforders","rating","numberofratings"
"Bouncing Car Dashboard Smileys Emoji Emoticon Toy - Dark Spider Man Deal Pool","Bouncing Car Dashboard Smileys Emoji Emoticon Toy - Dark Spider-Man While long driving if you are getting bore then we have something interesting for you which can entertain you through your destiny. We have Bouncing Car Dashboard Smiley’s Emoji Emoticon Toys. ;Out There is a list of outstanding and normally utilized Emoji or literary depictions of an authors dispositions or outward appearances as symbols. Initially, these symbols comprised of ASCII workmanship, and later, Shift_JIS craftsmanship and Unicode craftsmanship. As of late, graphical symbols, both static and vivified, have joined the customary content based Emoji; these are ordinarily known as emoticon.; An Emoji another way to say & feeling symbol& additionally referred to just as an act out, is a pictorial portrayal of an outward appearance utilizing characters—as a rule, accentuation stamps, numbers, and letters—to express an individuals emotions or state of mind, or as an efficient technique. As SMS and the web got boundless in the late 1990s, Emoji turned out to be progressively famous and were ordinarily utilized on instant messages, web gatherings and messages. Emoji have assumed a critical job in correspondence through innovation, and a few gadgets and applications have given adapted pictures that dont utilize content accentuation. They offer another scope of & tone& and feeling through messaging that depicts explicit feelings through facial motions while amidst content-based digital correspondence. SehgalMotors.PK has a list of different shaped Emoticon toys that you will love to place at your dashboard while driving. These toys can keep you happy and entertained throughout your way and hence they can make your road journey fun as well. We have Bouncing Car Dashboard Smiley’s Emoji Emoticon Toy - Dark Spider-Man;and many other shaped too. You can buy this from our outlets and from our online store as well which is SehgalMotors.PK.  ","parts","-",100.0,500,"[""https://sehgalmotors.pk/cdn/shop/products/1700916349018294_5ec9549f-9fd6-4817-bace-4d578c8689bf.jpg?v=1709816551"", ""https://sehgalmotors.pk/cdn/shop/products/637228325664342219.jpgnewop.jpg?v=1709816551"", ""https://sehgalmotors.pk/cdn/shop/products/637228325666529734.jpgnewop.jpg?v=1709816551"", ""https://sehgalmotors.pk/cdn/shop/products/637051040563850641.jpgnewop.jpg?v=1709816551""]","[""-""]","-","interior",0,0,0
"Universal Massage Back Rest Cushion With 12V Vibrator Seat - Black","Back Care Massage Seat Black Red 12v Do you drive for long hours? Do you have back pain? Well, we at SehgalMotors.PK has a solution. Back Care Massager Black. Often due to continuous, strenuous sitting in the uncomfortable car seat, you can develop spinal and lumbar pains, and you can even pull a muscle. This back pain is something that will cause a lot of agonies and will affect your day to day life and health. You will find a hard time sleeping or at times even sitting! Hence one of the best solutions is to get this Car seat massager. It vibrates and it has an attachable band so that it can easily be attached to a car seat. It comes in black color to match any cars interior.; Pains identified with the back are exceptionally weakening since it could influence the day by day exercises of whoever is influenced. At times, medications may do pretty much nothing or nothing in helping the nature of wellbeing, and all that might be required could be a decent help gadget or medical procedure in most pessimistic scenarios. A decent help gadget in such manner is a lumbar help cushion, and not simply in any case, the best kind accessible available to be purchased. Gives Relief: After a difficult day at work or strenuous exercise or errands at home, there is a need to unwind. With lumbar help pads, alleviation and solace are ensured for the client. Offers help: Sometimes, individuals strain their backs to do or do exercises, for example, driving. Lumbar bolster pad gives the help expected to the lower back area, making it increasingly advantageous and simpler to complete exercises. Safe: One thing you can make certain of with regards to supporting pads is that they are protected and condition amicable. They dont harbor any type of natural risk. You can buy this best quality;Back Care Massage Seat Black Red 12v from our outlets and from our online stores as well which is SehgalMotors.PK.; ;   ","parts","-",1800.0,500,"[""https://sehgalmotors.pk/cdn/shop/files/Universal-Massage-Back-Rest-Cushion-With-12V-Vibrator-Seat-Black-SehgalMotors-pk-871.jpg?v=1707967664"", ""https://sehgalmotors.pk/cdn/shop/files/Universal-Massage-Back-Rest-Cushion-With-12V-Vibrator-Seat-Black-SehgalMotors-pk-2318.jpg?v=1707967667"", ""https://sehgalmotors.pk/cdn/shop/files/Universal-Massage-Back-Rest-Cushion-With-12V-Vibrator-Seat-Black-SehgalMotors-pk-3885.jpg?v=1707967670"", ""https://sehgalmotors.pk/cdn/shop/files/Universal-Massage-Back-Rest-Cushion-With-12V-Vibrator-Seat-Black-SehgalMotors-pk-2885.jpg?v=1707967674""]","[""-""]","-","interior",0,0,0
"Universal Leather Type Gear Box Cover With Random Stitch Regular Fitting","Universal Leather Gear Cover ","parts","-",400.0,500,"[""https://sehgalmotors.pk/cdn/shop/files/Universal-Leather-Type-Gear-Box-Cover-With-Random-Stitch-Regular-Fitting-SehgalMotors-pk-9206.jpg?v=1707967576"", ""https://sehgalmotors.pk/cdn/shop/files/Universal-Leather-Type-Gear-Box-Cover-With-Random-Stitch-Regular-Fitting-SehgalMotors-pk-5854.jpg?v=1707967579""]","[""-""]","-","interior",0,0,0
"Small Stick Style Gear Knob Red","Stick Style Gear Knob Red; ","parts","-",1000.0,500,"[""https://sehgalmotors.pk/cdn/shop/files/Small-Stick-Style-Gear-Knob-Red-SehgalMotors-pk-5562.jpg?v=1707930878"", ""https://sehgalmotors.pk/cdn/shop/files/Small-Stick-Style-Gear-Knob-Red-SehgalMotors-pk-6842.jpg?v=1707930882"", ""https://sehgalmotors.pk/cdn/shop/files/Small-Stick-Style-Gear-Knob-Red-SehgalMotors-pk-7257.jpg?v=1707930885"", ""https://sehgalmotors.pk/cdn/shop/files/Small-Stick-Style-Gear-Knob-Red-SehgalMotors-pk-709.jpg?v=1707930889""]","[""-""]","-","interior",0,0,0
"Car Lumbar Support Memory Foam Cushion - Beige","Are you tired of experiencing discomfort and back pain during long drives? Say goodbye to those uncomfortable car seats and hello to the Car Lumbar Support Memory Foam Cushion in Beige. This premium-quality cushion is specially designed to enhance your driving comfort, providing excellent support to your lower back and promoting better posture. Whether youre heading on a road trip or commuting to work, this cushion is your ideal travel companion. Key Features: Ergonomic Design: The Car Lumbar Support Memory Foam Cushion is carefully contoured to fit the natural curve of your lower back. It provides targeted support to the lumbar region, reducing pressure and alleviating discomfort. Premium Memory Foam: Crafted with high-quality memory foam, this cushion offers superior comfort and molds to your bodys shape for personalized support. It effectively absorbs shocks and vibrations, ensuring a smooth ride. Breathable and Hypoallergenic Cover: The cushion comes with a beige-colored cover that is made from breathable and hypoallergenic materials. It promotes air circulation, preventing overheating and perspiration, while also being gentle on sensitive skin. Adjustable Straps: Equipped with adjustable straps, the cushion can be easily secured to any car seat. It remains in place, providing stable support even during sharp turns or sudden stops. ","parts","-",500.0,500,"[""https://sehgalmotors.pk/cdn/shop/files/Car-Lumbar-Support-Memory-Foam-Cushion-Beige-SehgalMotors-pk-7060.jpg?v=1707868479"", ""https://sehgalmotors.pk/cdn/shop/files/Car-Lumbar-Support-Memory-Foam-Cushion-Beige-SehgalMotors-pk-9359.jpg?v=1707868482"", ""https://sehgalmotors.pk/cdn/shop/files/Car-Lumbar-Support-Memory-Foam-Cushion-Beige-SehgalMotors-pk-406.jpg?v=1707868485""]","[""-""]","-","interior",0,0,0
"Maximus Genuine Leather Car Steering Anti Non Slip Wheel Cover - With Thread & Needle | Heat Resistant | Long Life","Maximus Genuine Leather Steering Cover | With Thread Needle | Heat Resistant | Long Life In Pakistan, the weather becomes hot or cold this extreme weather changing’s makes, the dashboards or the interiors of many cars crack. Sometimes they dont crack because they have a bit soft leather type material and its skin goes off. For protecting that, people put on dashboard carpets but they forget the steering wheels and leave them unprotected and uncovered. But after sometimes, when they leave their cars parked and the heat of the sun reaches the steering wheels, it ruins the skin of it. They then put on the common Tyre shaped steering wheel cover, which is made up of very low-quality Rexine. Their skins also get melted or get teased up after a month or 2. They also dont give a good grip. We have a solution to this problem. Its the Maximus Genuine Leather Steering Cover | With Thread Needle | Heat Resistant | Long Life. As you know, SehgalMotors.PK brings you the best quality products; today well tell you why this steering cover is better than the ones available in the local market. First of all this steering cover is branded and it is also a high-quality product. The ones available in the market are not branded. This one is made up of genuine leather but the ones in the local market are made up of Rexine. The ones in the local market dont have any kind of warranty, but SehgalMotors.PK gives you 1-year replacement warranty. As you can see in our videos, we have shown the Leather Identification test. Original leather never catches fire or never melts. We had light it up using a cigarette lighter, but it didnt catch fire. This means its leather and isnt Rexine. ;Maximus Genuine Leather Steering Cover | With Thread Needle | Heat Resistant | Long Life protects it and gives you a good grip.               ","parts","-",2300.0,500,"[""https://sehgalmotors.pk/cdn/shop/files/Maximus-Genuine-Leather-Car-Steering-Anti-Non-Slip-Wheel-Cover-With-Thread-Needle-Heat-Resistant-Long-Life-SehgalMotors-pk-6280.jpg?v=1707914248"", ""https://sehgalmotors.pk/cdn/shop/files/Maximus-Genuine-Leather-Car-Steering-Anti-Non-Slip-Wheel-Cover-With-Thread-Needle-Heat-Resistant-Long-Life-SehgalMotors-pk-399.jpg?v=1707914250"", ""https://sehgalmotors.pk/cdn/shop/files/Maximus-Genuine-Leather-Car-Steering-Anti-Non-Slip-Wheel-Cover-With-Thread-Needle-Heat-Resistant-Long-Life-SehgalMotors-pk-6237.jpg?v=1707914253"", ""https://sehgalmotors.pk/cdn/shop/files/Maximus-Genuine-Leather-Car-Steering-Anti-Non-Slip-Wheel-Cover-With-Thread-Needle-Heat-Resistant-Long-Life-SehgalMotors-pk-8785.jpg?v=1707914257"", ""https://sehgalmotors.pk/cdn/shop/files/Maximus-Genuine-Leather-Car-Steering-Anti-Non-Slip-Wheel-Cover-With-Thread-Needle-Heat-Resistant-Long-Life-SehgalMotors-pk-4593.jpg?v=1707914260"", ""https://sehgalmotors.pk/cdn/shop/files/Maximus-Genuine-Leather-Car-Steering-Anti-Non-Slip-Wheel-Cover-With-Thread-Needle-Heat-Resistant-Long-Life-SehgalMotors-pk-8985.jpg?v=1707914264"", ""https://sehgalmotors.pk/cdn/shop/files/Maximus-Genuine-Leather-Car-Steering-Anti-Non-Slip-Wheel-Cover-With-Thread-Needle-Heat-Resistant-Long-Life-SehgalMotors-pk-8369.jpg?v=1707914268"", ""https://sehgalmotors.pk/cdn/shop/files/Maximus-Genuine-Leather-Car-Steering-Anti-Non-Slip-Wheel-Cover-With-Thread-Needle-Heat-Resistant-Long-Life-SehgalMotors-pk-1097.jpg?v=1707914271""]","[""-""]","-","interior",0,0,0
"Toyota Logo Imported Neck Rest Headrest Pillow Cushion Black - Pair","Discover the perfect blend of style and comfort with the Toyota Logo Imported Neck Rest Headrest Pillow Cushion Black - Pair. Whether youre embarking on a road trip or simply commuting to work, these high-quality pillows are designed to provide unparalleled support for your neck and head. Crafted with precision and adorned with the iconic Toyota logo, these cushions are a must-have accessory for any Toyota owner or enthusiast. Read on to learn more about the features and benefits of this incredible product. Exceptional Comfort: Experience a new level of comfort during your daily drives with the Toyota Logo Imported Neck Rest Headrest Pillow Cushion. Made from premium materials, these cushions offer plush support for your neck and head, reducing fatigue and relieving tension. Say goodbye to discomfort and hello to relaxation with this luxurious accessory. Ergonomic Design: The ergonomic design of these headrest pillows ensures optimal support for your neck and head. The contoured shape fits perfectly with the natural curvature of your spine, promoting proper alignment and reducing strain. Enjoy a comfortable posture and minimize the risk of neck and shoulder pain while on the road. Premium Quality: Crafted with meticulous attention to detail, these headrest pillows are made to last. The high-quality materials used in their construction ensure durability and longevity, even with regular use. Rest assured knowing that youre investing in a product that will withstand the test of time and provide you with lasting comfort. ","parts","-",800.0,500,"[""https://sehgalmotors.pk/cdn/shop/files/Toyota-Logo-Imported-Neck-Rest-Headrest-Pillow-Cushion-Black-Pair-SehgalMotors-pk-9713.jpg?v=1707954549"", ""https://sehgalmotors.pk/cdn/shop/files/Toyota-Logo-Imported-Neck-Rest-Headrest-Pillow-Cushion-Black-Pair-SehgalMotors-pk-6213.jpg?v=1707954552""]","[""-""]","-","interior",0,0,0
"Car Leather Neck Rest Headrest Pillow Cushion Super Soft Memory Foam Beige - Pair","Upgrade your cars interior and elevate your driving experience with our Car Leather Neck Rest Headrest Pillow Cushion. Crafted with care and designed for comfort, these pillows are the perfect addition to enhance your cars seating arrangement. Made from premium quality materials, these super soft memory foam pillows offer exceptional support to your neck and head, ensuring a relaxed and enjoyable journey every time. Unparalleled Comfort: Experience a new level of comfort during your drives with our Car Leather Neck Rest Headrest Pillow Cushion. The high-quality memory foam adapts to the contours of your neck and head, providing optimal support and relieving any pressure points. Whether youre on a short commute or a long road trip, our pillows will help you relax and minimize discomfort. Ergonomic Design: The ergonomic design of our neck rest headrest pillows ensures that they fit perfectly with your cars seats, providing excellent neck and head support. The contoured shape helps maintain proper alignment, reducing strain and preventing stiffness, so you can enjoy a pain-free driving experience. The beige leather upholstery adds a touch of sophistication to your cars interior. Superior Durability: Our Car Leather Neck Rest Headrest Pillow Cushion is built to last. The high-quality leather material is not only soft to the touch but also resistant to wear and tear. The sturdy stitching ensures that the pillows maintain their shape and integrity over time, even with regular use. Invest in these pillows, and they will continue to provide luxurious comfort for years to come. Versatile and Easy to Install: Designed to be versatile, our neck rest headrest pillows are compatible with most car models. Installing them is a breeze - simply attach them to your cars headrest with the adjustable straps, and they will stay securely in place. You can also adjust the height and position of the pillows to suit your preference, ensuring a customized seating experience. ","parts","-",1000.0,500,"[""https://sehgalmotors.pk/cdn/shop/files/Car-Leather-Neck-Rest-Headrest-Pillow-Cushion-Super-Soft-Memory-Foam-Beige-Pair-SehgalMotors-pk-1797.jpg?v=1707868341"", ""https://sehgalmotors.pk/cdn/shop/files/Car-Leather-Neck-Rest-Headrest-Pillow-Cushion-Super-Soft-Memory-Foam-Beige-Pair-SehgalMotors-pk-2239.jpg?v=1707868344""]","[""-""]","-","interior",0,0,0
"Car Back Seat Air Inflatable Mattress Portable Bed Black","Car Back Seat Air Mattress Black | Inflatable Backseat Bed ;;;;;;;;;;; Air Mattress serves the purposes of a usual mattress or bed, except that its mainly used in the car but can also be used for other general usages. Its a great product for people who go for long drives or road trips and can also be useful for any car driver who gets tired and decides to rest in the car! Order now at SehgalMotors.PK. A Car Mattress, otherwise called an airbed or a blow-up bed, is an inflatable sleeping cushion made of polyvinyl chloride (PVC) or material of plastic or elastic. The flattened sleeping bed can be compacted and conveyed or put away in a little structure. They are swelled either by blowing into a valve, with a manual or electric pump. Some are naturally expanded when a valve is opened, up to a specific weight with extra expansion physically or by the pump. Car Bed cushions are utilized for outdoors, transitory or full-time home use, and possibly streamlined to consolidate a few uses (e.g., outdoors and visitor use) while others are the single reason. Inflatable cushions may have tweaked shapes, for instance, wheel patterns for use in the freight zone of a pickup truck or SUV. Dozing cushions are lightweight, diminished size and decreased thickness Changeless air beds will look practically like customary beds. The immovability can be balanced up or down, with the basic push of a catch, on the remote. You can buy it from our outlet and from our store which is SehgalMotors.PK. ;    ","parts","-",4700.0,500,"[""https://sehgalmotors.pk/cdn/shop/products/1709373967014069.jpg?v=1709373983"", ""https://sehgalmotors.pk/cdn/shop/products/636634647653795065.jpgnewop.jpgnewop.jpg?v=1709373983"", ""https://sehgalmotors.pk/cdn/shop/products/636634647654732410.jpgnewop.jpgnewop.jpg?v=1709373983"", ""https://sehgalmotors.pk/cdn/shop/products/636827367827002517.jpgnewop.jpgnewop.jpg?v=1709373983"", ""https://sehgalmotors.pk/cdn/shop/products/636827367830127509.jpgnewop.jpgnewop.jpg?v=1709373983"", ""https://sehgalmotors.pk/cdn/shop/products/636827367832002508.jpgnewop.jpgnewop.jpg?v=1709373983""]","[""-""]","-","interior",0,0,0
"Suzuki Mehran Arm Rest Like Dashboard Color Without Clips - Center Console Storage Box | Center Console | Elbow Rest Arm Holder","Suzuki Mehran Arm Rest Like Dashboard While driving a car on a long route, you may need to make your armrest for the purpose of having a relaxation journey. You must have something in your car to keep your arm there for resting position. Now for modern vehicles, we SehgalMotors.PK has the best solution in the form of having the best quality armrests for your car. This can also be fitted at chairs but mostly they are used in cars. It is inserted between the front seats and also among the back seats as well. It can also be used as a storage box also as it has space to save something in it as a secret place. Suzuki Mehran Arm Rest Like Dashboard has unique features and it is very convenient to put in your car along with you as they are available in different sizes and different styles according to your card designs. It also has cup holders along with storing some food items or other things as well. These are so modern now a day that they are having some other features too like providing non-essential features of controlling climate or windows motions as well. There are also other mentioned features like inserting with each individual set another arm set as well. Instead, it also has the feature to be inserted at doors aside while makes door pulling with handle easy and convenient. It can also be folded in a way that if you have to keep something at its place you can fold it and put that thing easily. Also known as: Arm Rest for Prado Best Arm Rest for cars High quality Arm Rest for cars Car Armrest In Pakistan Car Hand Rest Car Door Armrest This is also known as (Auto Armrest, Automotive Armrest, Armrest Myvi, Suzuki Mehran Armrest) ;     ","parts","-",1300.0,500,"[""https://sehgalmotors.pk/cdn/shop/products/1698237554SKU_20_208154_20_1.jpg?v=1708949992"", ""https://sehgalmotors.pk/cdn/shop/products/636441214339646590-IMG_2294.jpgnewop.jpg?v=1708949992"", ""https://sehgalmotors.pk/cdn/shop/products/636844556323215100.jpgnewop.jpg?v=1708949993"", ""https://sehgalmotors.pk/cdn/shop/products/638167342310852178.jpgnewop.jpg?v=1708949993"", ""https://sehgalmotors.pk/cdn/shop/products/638167342318196029.jpgnewop.jpg?v=1708949993"", ""https://sehgalmotors.pk/cdn/shop/products/638167342323977357.jpgnewop.jpg?v=1708949993"", ""https://sehgalmotors.pk/cdn/shop/products/638167342329446189.jpgnewop.jpg?v=1708949993"", ""https://sehgalmotors.pk/cdn/shop/products/638167342335383804.jpgnewop.jpg?v=1708949993""]","[""-""]","-","interior",0,0,0
"HL Gear Knob Cover For Manual Transmission Fur Style - Grey","HL Gear Knob Cover For Manual Transmission Fur Style - Grey ","parts","-",400.0,500,"[""https://sehgalmotors.pk/cdn/shop/files/637989473044563022.jpgnewop.jpg?v=1713876767"", ""https://sehgalmotors.pk/cdn/shop/files/637989473052844391.jpgnewop.jpg?v=1713876767""]","[""-""]","-","interior",0,0,0
"Toyota Mini Metal Seat Belt Clip Black - Pair - Car Safety Belt Buckle Alarm Canceler Stopper","Toyota Mini Seat Belt Clip Black A locking cut is a metal I-molded piece that is incorporated with most youngster limitation seats. Most seats have a spot on the back or base of the seat where you can store the locking cut. At the point when you buy the seat, it might be there or in a different sack. Whats more, some vehicle situates now have worked in locking components. Make certain to peruse the vehicle seat manual. In the event that your seat doesnt have a worked in the instrument and didnt accompany (or you lost) the locking cut, you can call the kid seat assembling to buy one. The locking cut isnt required for most vehicle seat establishments. The locking cut is required when the shoulder part of the vehicles lap/shoulder safety belt cant be bolted to hold the vehicle seat safely. This is the situation when your vehicle has crisis locking retractors on the shoulder belts — implying that the safety belt just bolts upon unexpected stop or impact — and cant be exchanged as in some more established vehicles. Notwithstanding, a few vehicles that have crisis locking retractors use locking latch plates to keep the safety belt tight, so verify whether the safety belt can be held tight with a locking latch plate before utilizing a locking cut. You ought not to utilize a locking cut on the off chance that it isnt required to appropriately introduce the vehicle seat in the vehicle. It is never utilized for a LATCH establishment or a lap-just belt establishment. SehgalMotors.PK offering you the best and most secure seat belts that;keep you secure during driving and helps you to restrain from being hurt. You can buy the best quality Toyota Mini Plastic Seat Belt Clip Black – Pair from our outlets and from our online store so log on to SehgalMotors.Pk now.;A belt without a clip is not a belt at all. To ensure your safety we offer a wide variety of options and designs when it comes to seatbelt clips. Everyone is annoyed when they here that raucous beep sound, and to shut it down, a seatbelt clip is inserted in the buckle. So order yours now; The seatbelt clip is also known as ( car seat clip, metal seatbelt clip, seat belt adjuster, gari ka clip, belt clip)  ","parts","-",400.0,500,"[""https://sehgalmotors.pk/cdn/shop/files/Toyota-Mini-Metal-Seat-Belt-Clip-Black-Pair-Car-Safety-Belt-Buckle-Alarm-Canceler-Stopper-SehgalMotors-pk-5672.jpg?v=1707955056"", ""https://sehgalmotors.pk/cdn/shop/files/Toyota-Mini-Metal-Seat-Belt-Clip-Black-Pair-Car-Safety-Belt-Buckle-Alarm-Canceler-Stopper-SehgalMotors-pk-9986.jpg?v=1707955086"", ""https://sehgalmotors.pk/cdn/shop/files/Toyota-Mini-Metal-Seat-Belt-Clip-Black-Pair-Car-Safety-Belt-Buckle-Alarm-Canceler-Stopper-SehgalMotors-pk-8117.jpg?v=1707955090"", ""https://sehgalmotors.pk/cdn/shop/files/Toyota-Mini-Metal-Seat-Belt-Clip-Black-Pair-Car-Safety-Belt-Buckle-Alarm-Canceler-Stopper-SehgalMotors-pk-5560.jpg?v=1707955093""]","[""-""]","-","interior",0,0,0
