"name","description","category","brand","price","quantity","images","compatibility","type","subcategory","numberoforders","rating","numberofratings"
"Plain Black Dotted Anti-Skid Nonslip Dashboard Mats - Silicon Type Material | Car Anti Slip Mat","Plain Black Dotted Dashboard Non Slip Mat Introducing our Plain Black Dotted Anti-Skid Nonslip Dashboard Mats, the perfect solution to keep your car neat, organized, and safe. Made from premium silicon material, these mats offer superior anti-slip properties to prevent your belongings from sliding off the dashboard while you drive. With their sleek and stylish design, these mats not only offer practicality but also enhance the aesthetics of your cars interior. Prevent Slippage, Stay Organized: Say goodbye to the frustration of items sliding around your dashboard while driving. Our Plain Black Dotted Anti-Skid Nonslip Dashboard Mats feature a dotted pattern that provides excellent grip to secure your belongings in place. From smartphones and sunglasses to keys and loose change, keep everything within easy reach and maintain a clutter-free dashboard. Durable Silicon Material: Crafted from high-quality silicon, our dashboard mats are built to withstand daily wear and tear. The silicon material offers exceptional durability, ensuring a long-lasting product that will serve you for years to come. Its heat-resistant and waterproof properties make it ideal for various weather conditions, including hot summers and rainy days. ","parts","-",500.0,500,"[""https://sehgalmotors.pk/cdn/shop/files/Plain-Black-Dotted-Anti-Skid-Nonslip-Dashboard-Mats-Silicon-Type-Material-Car-Anti-Slip-Mat-SehgalMotors-pk-5836.jpg?v=1707925380"", ""https://sehgalmotors.pk/cdn/shop/files/Plain-Black-Dotted-Anti-Skid-Nonslip-Dashboard-Mats-Silicon-Type-Material-Car-Anti-Slip-Mat-SehgalMotors-pk-7857.jpg?v=1707925384"", ""https://sehgalmotors.pk/cdn/shop/files/Plain-Black-Dotted-Anti-Skid-Nonslip-Dashboard-Mats-Silicon-Type-Material-Car-Anti-Slip-Mat-SehgalMotors-pk-7789.jpg?v=1707925387"", ""https://sehgalmotors.pk/cdn/shop/files/Plain-Black-Dotted-Anti-Skid-Nonslip-Dashboard-Mats-Silicon-Type-Material-Car-Anti-Slip-Mat-SehgalMotors-pk-887.jpg?v=1707925390"", ""https://sehgalmotors.pk/cdn/shop/files/Plain-Black-Dotted-Anti-Skid-Nonslip-Dashboard-Mats-Silicon-Type-Material-Car-Anti-Slip-Mat-SehgalMotors-pk-1124.jpg?v=1707925393""]","[""-""]","-","interior",0,0,0
"Toyota Logo Neck Rest Headrest Pillow Cushion Beige","Introducing the Toyota Logo Neck Rest Headrest Pillow Cushion Beige – the perfect accessory for any Toyota enthusiast seeking both comfort and style. Designed specifically to provide superior support to your neck and head during long drives, this premium-quality neck rest pillow cushion showcases the iconic Toyota logo while elevating your driving experience. Whether youre a dedicated Toyota owner or a fan of the brand, this neck rest pillow is a must-have addition to your vehicles interior. Unparalleled Comfort: Experience unparalleled comfort during your journeys with the Toyota Logo Neck Rest Headrest Pillow Cushion Beige. Crafted with high-quality materials and engineered to provide optimal support, this cushion offers a soft and plush surface for your neck and head. It effectively reduces strain and promotes a more relaxed driving posture, ensuring you reach your destination feeling refreshed and revitalized. Ergonomic Design: The ergonomic design of the Toyota Logo Neck Rest Headrest Pillow Cushion Beige guarantees a comfortable fit for users of all ages. Its contoured shape conforms to the natural curvature of your neck and spine, providing targeted support where its needed most. The cushions adjustable strap ensures a secure attachment to your vehicles headrest, preventing any unwanted slipping or movement during your drive. ","parts","-",1000.0,500,"[""https://sehgalmotors.pk/cdn/shop/files/Toyota-Logo-Neck-Rest-Headrest-Pillow-Cushion-Beige-SehgalMotors-pk-6524.jpg?v=1707954589"", ""https://sehgalmotors.pk/cdn/shop/files/Toyota-Logo-Neck-Rest-Headrest-Pillow-Cushion-Beige-SehgalMotors-pk-1017.jpg?v=1707954592""]","[""-""]","-","interior",0,0,0
"Medicated Neck Massager Pillow - Electric Massage Pillow Vibrator Relaxation Shoulder Neck Back Body Heating Kneading Infrared Therapy","Medicated Neck Massager Pillow comes with a car socket only for power. This does not include any 220v adapter. but it is optional. The box is a universal one, only includes the power cable for car. Are you tired of dealing with neck pain and discomfort? Look no further! Introducing our Medicated Neck Massager Pillow, a cutting-edge product designed to alleviate your neck woes. Say goodbye to stiffness and tension as our innovative pillow combines advanced technology with exceptional comfort. Read on to learn how our Medicated Neck Massager Pillow can provide you with the ultimate relaxation and relief you deserve. Benefits of our Medicated Neck Massager Pillow: Targeted Pain Relief: Our Medicated Neck Massager Pillow features advanced massaging nodes that target specific pressure points in your neck and shoulders. By applying gentle yet effective pressure, it relieves muscle tension and promotes blood circulation, easing your pain and discomfort. Customizable Massage Modes: We understand that everyones needs are different. Thats why our Medicated Neck Massager Pillow offers multiple massage modes and intensity levels. Choose from various settings to find the perfect massage experience tailored to your preferences. Heat Therapy for Deep Relaxation: Experience the soothing warmth of heat therapy integrated into our neck massager pillow. The gentle heat penetrates deep into your muscles, promoting relaxation and helping to alleviate stress and tension. Its the perfect way to unwind after a long day. Ergonomic Design: Our Medicated Neck Massager Pillow is designed with your comfort in mind. Its contoured shape fits perfectly around your neck and shoulders, providing optimal support. The soft, plush fabric enhances the overall experience, making it a treat for your senses. Portable and Versatile: Whether youre at home, in the office, or on the go, our Medicated Neck Massager Pillow is your reliable companion. Its lightweight, portable, and comes with a rechargeable battery, ensuring you can enjoy a soothing massage anytime, anywhere. Improved Sleep Quality: Say goodbye to restless nights and wake up feeling refreshed. The Medicated Neck Massager Pillow helps relax your neck and shoulders, promoting better sleep quality. Its the ideal addition to your bedtime routine for a more restful nights sleep. ","parts","-",3333.0,500,"[""https://sehgalmotors.pk/cdn/shop/files/Medicated-Neck-Massager-Pillow-Electric-Massage-Pillow-Vibrator-Relaxation-Shoulder-Neck-Back-Body-Heating-Kneading-Infrared-Therapy-SehgalMotors-pk-6666.jpg?v=1707917223"", ""https://sehgalmotors.pk/cdn/shop/files/Medicated-Neck-Massager-Pillow-Electric-Massage-Pillow-Vibrator-Relaxation-Shoulder-Neck-Back-Body-Heating-Kneading-Infrared-Therapy-SehgalMotors-pk-9495.jpg?v=1707917226"", ""https://sehgalmotors.pk/cdn/shop/files/Medicated-Neck-Massager-Pillow-Electric-Massage-Pillow-Vibrator-Relaxation-Shoulder-Neck-Back-Body-Heating-Kneading-Infrared-Therapy-SehgalMotors-pk-1136.jpg?v=1707917229"", ""https://sehgalmotors.pk/cdn/shop/files/Medicated-Neck-Massager-Pillow-Electric-Massage-Pillow-Vibrator-Relaxation-Shoulder-Neck-Back-Body-Heating-Kneading-Infrared-Therapy-SehgalMotors-pk-8200.jpg?v=1707917232""]","[""-""]","-","interior",0,0,0
"Toyota Corolla Dashboard Carpet For Protection and Heat Resistance Black - Model - 2004 - 2008","Toyota Corolla Dashboard Carpet Black - Model - 2004 - 2008 ","parts","-",800.0,500,"[""https://sehgalmotors.pk/cdn/shop/products/1698739708313619.jpg?v=1709190757"", ""https://sehgalmotors.pk/cdn/shop/products/636792748729197586.jpgnewop.jpg?v=1709190757""]","[""-""]","-","interior",0,0,0
"Suzuki Swift Dashboard Carpet Velvet For Protection and Heat Resistance - Model 2022-2023","Introducing the Suzuki Swift Dashboard Carpet Velvet for Model 2022-2023: Premium Protection and Unmatched Heat Resistance Upgrade your Suzuki Swifts interior with the exquisite Suzuki Swift Dashboard Carpet Velvet, specifically designed to provide superior protection and heat resistance for your vehicles dashboard. Crafted with precision and made from high-quality materials, this dashboard carpet is the perfect accessory to enhance both the aesthetics and functionality of your car. Unparalleled Protection: With the Suzuki Swift Dashboard Carpet Velvet, you can safeguard your dashboard against daily wear and tear, spills, and scratches. Its durable construction acts as a shield, preserving the pristine condition of your dashboard and ensuring its longevity. Say goodbye to unsightly marks and fading caused by sunlight, dust, or accidental spills – this carpet is here to keep your dashboard looking brand new. Luxurious Velvet Material: Immerse yourself in sheer luxury with the plush velvet material of this dashboard carpet. Its soft and velvety texture adds a touch of elegance to your vehicles interior, creating a premium atmosphere that elevates your driving experience. The luxurious velvet not only enhances aesthetics but also provides a comfortable surface for your hands to rest on during long drives. Unmatched Heat Resistance: Say goodbye to scorching hot dashboards during the sweltering summer months. The Suzuki Swift Dashboard Carpet Velvet is designed with advanced heat-resistant properties to withstand intense temperatures. It effectively deflects the suns heat, preventing the dashboard from overheating and reducing the risk of damage or cracking. Enjoy a cooler cabin environment while protecting your dashboard simultaneously. Tailor-Made Fit: This dashboard carpet is meticulously crafted to fit the contours of your Suzuki Swifts dashboard perfectly. It features precise cutouts for air vents, speakers, and other essential components, ensuring hassle-free installation without obstructing any functionalities. The tailored fit seamlessly integrates into your vehicles interior, providing a sleek and polished appearance. ","parts","-",2500.0,500,"[""https://sehgalmotors.pk/cdn/shop/products/1698740687028644.jpg?v=1708950889"", ""https://sehgalmotors.pk/cdn/shop/products/638084554465486190.jpgnewop.jpg?v=1708950889""]","[""-""]","-","interior",0,0,0
"Maximus Neck Rest Headrest Pillow Cushion Black","Maximus Neck Rest Pillow Black Back pain is common among adults, so we are providing Car Back Care and Accessories to help you drive your car with utmost ease and comfort. Normally car seats are not made to provide the best support for your back or anyone else’s because they are designed for an average-sized human being. Which means if you are smaller or taller than average then you cannot sit comfortably in your car seat and need back care products for your car. So, do not worry because SehgalMotors.pk has a huge variety of Back Care and its accessories available for you. We are selling different car interior products on our website, including items to keep your back and neck totally relaxed while you are driving your car. We have Back Care Massager seats that will massage your back as you drive your car through traffic, storms or bumpy roads. Back Rest Cushions are also available on our website along with Universal Backrests that will help you keep your back straight without putting any stress on your back muscles. If your neck hurts while driving then you should get some Neck Rest Pillows, available in different shapes and colours, from our platform. If you use our Car Neck Rests then you will get no headaches because your neck will be in the proper position at all times. Also, we have Medicated Neck Massager Pillows that you can use in your car and at your home. The category of Back Care and Accessories also offers Back Seat Organizers that are made from various materials like leather, nylon, fuzzy fleece and more. They help to keep your things organized as you can store lots of things in its various pockets and compartments. Seat Organizers come with tablet holders, cup holders, trays and many pockets for making your ride comfortable and well-organized. Buy from the thousands of premium quality care products available on our website. We are selling our Maximus Neck Rest Pillow Black and their accessories on moderate prices. So, buy them now and forget about all your back and neck pains at SehgalMotors.PK.  ","parts","-",2500.0,500,"[""https://sehgalmotors.pk/cdn/shop/files/Maximus-Neck-Rest-Headrest-Pillow-Cushion-Black-SehgalMotors-pk-3813.jpg?v=1707915134"", ""https://sehgalmotors.pk/cdn/shop/files/Maximus-Neck-Rest-Headrest-Pillow-Cushion-Black-SehgalMotors-pk-8298.jpg?v=1707915137"", ""https://sehgalmotors.pk/cdn/shop/files/Maximus-Neck-Rest-Headrest-Pillow-Cushion-Black-SehgalMotors-pk-8346.jpg?v=1707915140""]","[""-""]","-","interior",0,0,0
"Car Mini Thrash Dust Bin - Trash Can | Car Trash Can Garbage Dust | NEW Car Garbage Can Car Trash Can Garbage Dust Case Holder Bin","Welcome to the world of hassle-free car cleanliness! Introducing the Car Mini Trash Dust Bin, the perfect solution to keep your vehicle free from trash and debris. Whether youre on a road trip or just commuting to work, this compact and portable dust bin is a must-have accessory for every car owner. Read on to learn how this handy device can revolutionize your car cleaning routine. Compact and Convenient: The Car Mini Trash Dust Bin is designed to fit perfectly in your car without taking up valuable space. Its compact size allows you to place it anywhere within your reach, including the dashboard, center console, or door pocket. With its sleek and modern design, it seamlessly blends with your cars interior, adding a touch of elegance. Easy to Use: Keeping your car clean has never been easier! The Car Mini Trash Dust Bin features a user-friendly design that enables effortless waste disposal. Simply open the bin lid with one hand, deposit the trash, and close it securely to prevent any odors or mess. Its the ultimate solution for maintaining a clutter-free car environment. Odor-Free and Leak-Proof: Say goodbye to unpleasant smells and messy spills! The Car Mini Trash Dust Bin is equipped with an airtight lid that seals in odors and prevents any leakage. The bin is lined with a waterproof and washable inner lining, ensuring easy maintenance and hygiene. Now you can enjoy a fresh and clean car every time you hit the road. Versatile and Multi-Purpose: This versatile dust bin is not just limited to trash disposal. It can also be used to store small items such as tissues, receipts, wrappers, and more. With its ample capacity, you can keep your car organized and clutter-free. The Car Mini Trash Dust Bin truly enhances your driving experience by providing a practical storage solution. Durable and Long-Lasting: Crafted from high-quality materials, the Car Mini Trash Dust Bin is built to withstand the rigors of daily car use. Its sturdy construction ensures durability and longevity, making it a reliable companion for your car cleaning needs. Invest in this long-lasting product and enjoy a clean and tidy car interior for years to come.  ","parts","-",1000.0,500,"[""https://sehgalmotors.pk/cdn/shop/products/1696244774017837.jpg?v=1707913637"", ""https://sehgalmotors.pk/cdn/shop/products/636979532900431143.jpgnewop.jpg?v=1707913637""]","[""-""]","-","interior",0,0,0
"Toyota Corolla Dashboard Carpet For Protection and Heat Resistance Black - Model - 2018 -2021","When it comes to protecting your cars dashboard and keeping it looking like new, the Toyota Corolla Dashboard Carpet is an excellent choice. Designed specifically for the 2018-2021 model years, this black dashboard carpet is made from high-quality materials that provide both protection and heat resistance. One of the main benefits of this dashboard carpet is that it helps to prevent damage from the suns UV rays. Over time, exposure to sunlight can cause your dashboard to fade, crack, and become brittle. The Toyota Corolla Dashboard Carpet helps to block out harmful UV rays, which helps to preserve the look and feel of your dashboard. In addition to providing protection from the sun, this dashboard carpet also helps to insulate your dashboard against heat. During the hot summer months, the interior of your car can quickly become uncomfortably hot, especially if its parked in direct sunlight. The Toyota Corolla Dashboard Carpet helps to keep your dashboard cool, which can make your overall driving experience more comfortable. ","parts","-",800.0,500,"[""https://sehgalmotors.pk/cdn/shop/products/1698739728313616_e6313aeb-4d41-4171-8f14-000988d9d19f.jpg?v=1709190792"", ""https://sehgalmotors.pk/cdn/shop/products/636784919855726687.jpgnewop_278e923a-a081-4e4f-839f-18452541a591.jpg?v=1709190792""]","[""-""]","-","interior",0,0,0
"Car Net String Box Side Pocket Organizer Bags Baskets Mobile Phone Holder Large","Car-Net String Box Side Pocket Organizer Bags Baskets Mobile Phone Holder Large They are utilized for holding your telephone. It is helpful when you are utilizing the route. These days, some holders go with the charging point, which is fuel by 2.0v attachment, or USB input. The mount should keep your telephone at eye level and furthermore vehicle mount ought to be anything but difficult to utilize. That is the reason I would suggest it. Telephone stands offer clients a few key advantages, for example, improved solace, wellbeing, and efficiency. We should investigate every one of these advantages so you can choose if obtaining a phone holder is directly for you. The principle bit of leeway of utilizing a telephone stand is that it changes your telephone into a sans hands gadget. On the off chance that you appreciate utilizing your telephone to watch motion pictures or read books while unwinding in bed, at that point youve most likely encountered the solid neck and numb fingers and wrists that accompany this movement. In any case, you can utilize a work area telephone remain to lay your telephone on your end table so you do not need to keep up that awkward hold on it. On the other hand, you can utilize a flexible gooseneck holder to lighten your day directly over your take or off to your side. In any case, your neck will feel much improved, your hands will not be confined and you can move about in bed or even nod off without stressing over dropping your telephone. Telephone stands are likewise incredible for expanding profitability. SehgalMotors.PK offers you the best Car-Net String Box Side Pocket Organizer Bags Baskets Mobile Phone Holder Large that will help you to keep your phone safely at your dashboard. Therefore, during driving, you can easily keep your phone in this holder and you can use it freely as well. So grab your best quality Car Phone Holder from our outlets and from our online stores just log on to SehgalMotors.PK.   ","parts","-",250.0,500,"[""https://sehgalmotors.pk/cdn/shop/files/Car-Net-String-Box-Side-Pocket-Organizer-Bags-Baskets-Mobile-Phone-Holder-Large-SehgalMotors-pk-13.jpg?v=1707868648"", ""https://sehgalmotors.pk/cdn/shop/files/Car-Net-String-Box-Side-Pocket-Organizer-Bags-Baskets-Mobile-Phone-Holder-Large-SehgalMotors-pk-4302.jpg?v=1707868651"", ""https://sehgalmotors.pk/cdn/shop/files/Car-Net-String-Box-Side-Pocket-Organizer-Bags-Baskets-Mobile-Phone-Holder-Large-SehgalMotors-pk-4324.jpg?v=1707868654"", ""https://sehgalmotors.pk/cdn/shop/files/Car-Net-String-Box-Side-Pocket-Organizer-Bags-Baskets-Mobile-Phone-Holder-Large-SehgalMotors-pk-4052.jpg?v=1707868658"", ""https://sehgalmotors.pk/cdn/shop/files/Car-Net-String-Box-Side-Pocket-Organizer-Bags-Baskets-Mobile-Phone-Holder-Large-SehgalMotors-pk-2662.jpg?v=1707868662"", ""https://sehgalmotors.pk/cdn/shop/files/Car-Net-String-Box-Side-Pocket-Organizer-Bags-Baskets-Mobile-Phone-Holder-Large-SehgalMotors-pk-1508.jpg?v=1707868665"", ""https://sehgalmotors.pk/cdn/shop/files/Car-Net-String-Box-Side-Pocket-Organizer-Bags-Baskets-Mobile-Phone-Holder-Large-SehgalMotors-pk-7909.jpg?v=1707868669""]","[""-""]","-","interior",0,0,0
"Toyota Aqua Dashboard Carpet For Protection and Heat Resistance Black - Model - 2012-2017","Toyota Aqua Dashboard Carpet for Protection and Heat Resistance Black - Model - 2012 – 2017 A Carpet is a material floor covering ordinarily comprising of an upper layer of heap connected to a sponsorship. The heap was generally produced using fleece, however since the twentieth century, manufactured filaments, for example, polypropylene, nylon or polyester are frequently utilized, as these strands are more affordable than fleece. The heap, for the most part, comprises curved tufts which are normally heat-treated to keep up their structure. The term cover is regularly utilized conversely with the term carpet, in spite of the fact that mats are commonly viewed as littler than a room and not appended to the floor. Rugs are utilized for an assortment of purposes, including protecting an individuals feet from a virus tile or solid floor, making a room increasingly agreeable as a spot to sit on the floor (e.g., when playing with youngsters or as a supplication mat), diminishing sound from strolling (especially in high rises) and adding embellishment or shading to a room. Floor coverings can be made in any shading by utilizing contrastingly colored filaments. Floor coverings can have a wide range of kinds of examples and themes used to embellish the surface. Floor coverings are utilized in mechanical and business foundations, for example, retail locations and inns and in private homes. During the 2010s, the enormous scope of rugs and mats are accessible at many costs and quality levels, extending from cheap, engineered floor coverings that are mass-delivered in production lines and utilized in business structures too expensive hand-tied fleece mats which are utilized in private homes of rich families. Carpets for car dashboards are also available nowadays that are making the dashboards more innovative and attractive as many of the times you need to place something on your dashboard and you will find it useful for you. SehgalMotors.PK has the best dashboard carpet mats that are made of high-quality material or fabric that makes your car dashboard more attractive. We have Toyota Aqua Dashboard Carpet for Protection and Heat Resistance Black - Model - 2012 – 2017 from our outlets and from our online stores as well which is SehgalMotors.PK.   ","parts","-",800.0,500,"[""https://sehgalmotors.pk/cdn/shop/products/1698739660313634.jpg?v=1709027761"", ""https://sehgalmotors.pk/cdn/shop/products/636784972486440320.jpgnewop.jpg?v=1709027761"", ""https://sehgalmotors.pk/cdn/shop/products/637227474635645808.jpgnewop.jpg?v=1709027761"", ""https://sehgalmotors.pk/cdn/shop/products/637227474637051952.jpgnewop.jpg?v=1709027761""]","[""-""]","-","interior",0,0,0
"Bouncing Car Dashboard Smileys Emoji Emoticon Toy - Blue Emoji","Bouncing Car Dashboard Smileys Emoji Emoticon Toy - Captain America While long driving if you are getting bore then we have something interesting for you which can entertain you through your destiny. We have Bouncing Car Dashboard Smiley’s Emoji Emoticon Toys. ;Out There is a list of outstanding and normally utilized Emoji or literary depictions of an authors dispositions or outward appearances as symbols. Initially, these symbols comprised of ASCII workmanship, and later, Shift_JIS craftsmanship and Unicode craftsmanship. As of late, graphical symbols, both static and vivified, have joined the customary content based Emoji; these are ordinarily known as emoticon.; An Emoji another way to say & feeling symbol& additionally referred to just as an act out, is a pictorial portrayal of an outward appearance utilizing characters—as a rule, accentuation stamps, numbers, and letters—to express an individuals emotions or state of mind, or as an efficient technique. As SMS and the web got boundless in the late 1990s, Emoji turned out to be progressively famous and were ordinarily utilized on instant messages, web gatherings and messages. Emoji have assumed a critical job in correspondence through innovation, and a few gadgets and applications have given adapted pictures that dont utilize content accentuation. They offer another scope of & tone& and feeling through messaging that depicts explicit feelings through facial motions while amidst content-based digital correspondence. SehgalMotors.PK has a list of different shaped Emoticon toys that you will love to place at your dashboard while driving. These toys can keep you happy and entertained throughout your way and hence they can make your road journey;fun as well. We have Bouncing Car Dashboard Smiley’s Emoji Emoticon Toy - Captain America and many other shaped too. You can buy this from our outlets and from our online store as well which is SehgalMotors.PK.  ","parts","-",100.0,500,"[""https://sehgalmotors.pk/cdn/shop/files/1700916356018292.jpg?v=1715841044"", ""https://sehgalmotors.pk/cdn/shop/files/637051039318017441.jpgnewop.jpg?v=1715841044"", ""https://sehgalmotors.pk/cdn/shop/files/637274715175688996.jpgnewop.jpg?v=1715841044"", ""https://sehgalmotors.pk/cdn/shop/files/638041094010128041.jpgnewop.jpg?v=1715841044""]","[""-""]","-","interior",0,0,0
