"name","description","category","brand","price","quantity","images","compatibility","type","subcategory","numberoforders","rating","numberofratings"
"Suzuki Cultus Dashboard Carpet For Protection and Heat Resistance with Suzuki Logo Old Model - Model 2000-2016","Suzuki Cultus Dashboard Carpet For Protection and Heat Resistance with Suzuki Logo - Model 2000-2016 A Carpet is a material floor covering ordinarily comprising of an upper layer of heap connected to a sponsorship. The heap was generally produced using fleece, however since the twentieth century, manufactured filaments, for example, polypropylene, nylon or polyester are frequently utilized, as these strands are more affordable than fleece. The heap, for the most part, comprises curved tufts which are normally heat-treated to keep up their structure. The term cover is regularly utilized conversely with the term carpet, in spite of the fact that mats are commonly viewed as littler than a room and not appended to the floor. Rugs are utilized for an assortment of purposes, including protecting an individuals feet from a virus tile or solid floor, making a room increasingly agreeable as a spot to sit on the floor (e.g., when playing with youngsters or as a supplication mat), diminishing sound from strolling (especially in high rises) and adding embellishment or shading to a room. Floor coverings can be made in any shading by utilizing contrastingly colored filaments. Floor coverings can have a wide range of kinds of examples and themes used to embellish the surface. Floor coverings are utilized in mechanical and business foundations, for example, retail locations and inns and in private homes. During the 2010s, the enormous scope of rugs and mats are accessible at many costs and quality levels, extending from cheap, engineered floor coverings that are mass-delivered in production lines and utilized in business structures too expensive hand-tied fleece mats which are utilized in private homes of rich families. Carpets for car dashboards are also available nowadays that are making the dashboards more innovative and attractive as many of the times you need to place something on your dashboard and you will find it useful for you. SehgalMotors.PK has the best dashboard carpet mats that are made of high-quality material or fabric that makes your car dashboard more attractive. We have Suzuki Cultus Dashboard Carpet For Protection and Heat Resistance with Suzuki Logo - Model 2000-2016 from our outlets and from our online stores as well which is SehgalMotors.PK. ","parts","-",800.0,500,"[""https://sehgalmotors.pk/cdn/shop/files/Suzuki-Cultus-Dashboard-Carpet-For-Protection-and-Heat-Resistance-with-Suzuki-Logo-Old-Model-Model-2000-2016-SehgalMotors-pk-8651.jpg?v=1707935563"", ""https://sehgalmotors.pk/cdn/shop/files/Suzuki-Cultus-Dashboard-Carpet-For-Protection-and-Heat-Resistance-with-Suzuki-Logo-Old-Model-Model-2000-2016-SehgalMotors-pk-596.jpg?v=1707935565"", ""https://sehgalmotors.pk/cdn/shop/files/Suzuki-Cultus-Dashboard-Carpet-For-Protection-and-Heat-Resistance-with-Suzuki-Logo-Old-Model-Model-2000-2016-SehgalMotors-pk-65.jpg?v=1707935569"", ""https://sehgalmotors.pk/cdn/shop/files/Suzuki-Cultus-Dashboard-Carpet-For-Protection-and-Heat-Resistance-with-Suzuki-Logo-Old-Model-Model-2000-2016-SehgalMotors-pk-785.jpg?v=1707935573""]","[""-""]","-","interior",0,0,0
"Universal Seat Gap Filler Leakproof Black - Each","Universal Seat Gap Filler Leakproof Black - Each In almost all Cars there is a Gap between seats and Gears that disturbs drivers as anything can get down there and become stuck there. This causes a problem for them very much and they remain to disturbed while driving if the thing slipped there. Mostly Car users have to face this issue and they want a solution for this. Many of the time especially phone get slipped over there while keeping it in the lap. This problem has now a great solution in the form of Seat Gap Fillers for Cars. This product will fill up all the Gaps between your seats and also provides you with the Cup Holders facility as well in which you can keep your cups and glasses during driving and also has a portion in which you can keep your phone along with Glass and cups. This product Cup Drink Holder for Cars is a very useful product for cars as they provide a place to keep the glass and cup in your car properly and fills the gaps between the seats as it is more secure as well. The best Cup drink holders are available only at SehgalMotors.PK. Every design and colour of your car according to your model and choice is available at our outlets and online stores which you can buy at any time and can visit our outlets as we provide its fittings as well if you want our services with our products as well. This Universal Seat Gap Filler Leakproof Black - Each;is the best for your car in Pakistan high-quality Seat Gap Fillers are only available at SehgalMotors.PK. You can easily buy if from our outlets and from our online stores which is SehgalMotors.PK.  ","parts","-",400.0,500,"[""https://sehgalmotors.pk/cdn/shop/files/636873208026905300.jpgnewop.jpg?v=1713172734"", ""https://sehgalmotors.pk/cdn/shop/files/636873208027686709.jpgnewop.jpg?v=1713172734"", ""https://sehgalmotors.pk/cdn/shop/files/636824668522890635.jpgnewop.jpg?v=1713172734""]","[""-""]","-","interior",0,0,0
"Honda Civic X Die Cast Car Toy Black - Model 2016 -2021","Honda Civic X Die Cast Car Toy Black - Model 2016 - 2020;; ;  ","parts","-",3000.0,500,"[""https://sehgalmotors.pk/cdn/shop/files/Honda-Civic-X-Die-Cast-Car-Toy-Black-Model-2016-2021-SehgalMotors-pk-6889.jpg?v=1707896961"", ""https://sehgalmotors.pk/cdn/shop/files/Honda-Civic-X-Die-Cast-Car-Toy-Black-Model-2016-2021-SehgalMotors-pk-7291.jpg?v=1707896965""]","[""-""]","-","interior",0,0,0
"Portable Sunglasses Holder - Car Sun Glass Clip Storage Holder","Portable Sunglasses Holder ","parts","-",400.0,500,"[""https://sehgalmotors.pk/cdn/shop/files/Portable-Sunglasses-Holder-Car-Sun-Glass-Clip-Storage-Holder-SehgalMotors-pk-9737.jpg?v=1707926014"", ""https://sehgalmotors.pk/cdn/shop/files/Portable-Sunglasses-Holder-Car-Sun-Glass-Clip-Storage-Holder-SehgalMotors-pk-4725.jpg?v=1707926018""]","[""-""]","-","interior",0,0,0
"Plastic Arm Rest With Leather - Center Console Storage Box | Center Console | Elbow Rest Arm Holder","Plastic Arm Rest With Leather Driving has lways been a hassle and a tiresome conundrum when you do not have any arm support. But now things wont be the same, when you will drive with comfort and ease with Speedwav Car Armrest. Its main features include,;provides comfort while driving, box inside has good storage space for your CDs, Money Change, Cigarette, Mobile, etc. Top Cushion covered with eco-leather for great looks and comfort. No obstructions in hand-brakes usage 5.5cm. Adjustable arm top which can be slided forward depending upon the comfort position. Foldable design to vertically fold the arm rest aligned to seats when not required. Adjustable height settings with the help of support plates and screws provided with the package. This is also known as (Auto Armrest, Automotive Armrest, Armrest Myvi) ","parts","-",2100.0,500,"[""https://sehgalmotors.pk/cdn/shop/files/Plastic-Arm-Rest-With-Leather-Center-Console-Storage-Box-Center-Console-Elbow-Rest-Arm-Holder-SehgalMotors-pk-1066.jpg?v=1707925438"", ""https://sehgalmotors.pk/cdn/shop/files/Plastic-Arm-Rest-With-Leather-Center-Console-Storage-Box-Center-Console-Elbow-Rest-Arm-Holder-SehgalMotors-pk-7865.jpg?v=1707925442""]","[""-""]","-","interior",0,0,0
"Bouncing Car Dashboard Smileys Emoji Emoticon Toy - Iron Man","Bouncing Car Dashboard Smileys Emoji Emoticon Toy - Iron Man While long driving if you are getting bore then we have something interesting for you which can entertain you through your destiny. We have Bouncing Car Dashboard Smiley’s Emoji Emoticon Toys. ;Out There is a list of outstanding and normally utilized Emoji or literary depictions of an authors dispositions or outward appearances as symbols. Initially, these symbols comprised of ASCII workmanship, and later, Shift_JIS craftsmanship and Unicode craftsmanship. As of late, graphical symbols, both static and vivified, have joined the customary content based Emoji; these are ordinarily known as emoticon.; An Emoji another way to say & feeling symbol& additionally referred to just as an act out, is a pictorial portrayal of an outward appearance utilizing characters—as a rule, accentuation stamps, numbers, and letters—to express an individuals emotions or state of mind, or as an efficient technique. As SMS and the web got boundless in the late 1990s, Emoji turned out to be progressively famous and were ordinarily utilized on instant messages, web gatherings and messages. Emoji have assumed a critical job in correspondence through innovation, and a few gadgets and applications have given adapted pictures that dont utilize content accentuation. They offer another scope of & tone& and feeling through messaging that depicts explicit feelings through facial motions while amidst content-based digital correspondence. SehgalMotors.PK has a list of different shaped Emoticon toys that you will love to place at your dashboard while driving. These toys can keep you happy and entertained throughout your way and hence they can make your road journey fun as well. We have Bouncing Car Dashboard Smiley’s Emoji Emoticon Toy - Iron Man and many other shaped too. You can buy this from our outlets and from our online store as well which is SehgalMotors.PK.  ","parts","-",100.0,500,"[""https://sehgalmotors.pk/cdn/shop/files/1700916676018289_20_1.jpg?v=1713012486"", ""https://sehgalmotors.pk/cdn/shop/files/637051039111697866.jpgnewop.jpg?v=1713012486""]","[""-""]","-","interior",0,0,0
"U-Shape Pain Relieve Gel Foam Seat Cushion Pressure Relief - Sciatica Pain Treatment For Car/Home/Office | Multi Colors","Welcome to our exclusive U-Shape Pain Relieve Gel Foam Seat Cushion, designed to provide unparalleled comfort and alleviate the symptoms of sciatica pain. Whether youre dealing with discomfort during long drives, at home while working or relaxing, or even in your office chair, our cushion offers the perfect solution to relieve pressure and enhance your overall well-being. Pressure Relief and Sciatica Pain Treatment: The U-Shape Pain Relieve Gel Foam Seat Cushion is meticulously crafted to provide targeted pressure relief, making it ideal for individuals suffering from sciatica pain or those seeking enhanced comfort during prolonged periods of sitting. The unique U-shape design and gel-infused memory foam work in tandem to distribute weight evenly, reducing pressure on the tailbone, hips, and lower back. Unmatched Comfort Wherever You Go: Whether youre traveling in your car, sitting at your desk, or enjoying a movie night at home, our cushion is versatile and portable, providing you with relief wherever you need it most. The multi-colored design adds a touch of style to any environment, making it an attractive addition to your seating arrangements. Promote Better Posture: Maintaining proper posture is essential for preventing pain and discomfort. The U-Shape Pain Relieve Gel Foam Seat Cushion helps you achieve and maintain an ergonomic seated position. By aligning your spine correctly, this cushion encourages healthy posture habits, reducing strain on your muscles and providing long-lasting relief. ","parts","-",4000.0,500,"[""https://sehgalmotors.pk/cdn/shop/products/1696321980018507_943eadd1-bff9-49a1-bb33-848bf92f997c.jpg?v=1709373872"", ""https://sehgalmotors.pk/cdn/shop/products/gc1.jpgnewop_76e0e781-1ac5-4178-a461-2953a119210a.jpg?v=1709373872"", ""https://sehgalmotors.pk/cdn/shop/products/gc3.jpgnewop_80fd2780-18e5-4235-b21b-b12295ddadec.jpg?v=1709373872"", ""https://sehgalmotors.pk/cdn/shop/products/637219641136563611.jpgnewop_4ea06950-96bf-429f-8f1a-72ef8cc534fc.jpg?v=1709373872"", ""https://sehgalmotors.pk/cdn/shop/products/637219641137813820.jpgnewop_7efe6acc-abd0-4196-9d9c-640b1ae208c6.jpg?v=1709373873"", ""https://sehgalmotors.pk/cdn/shop/products/637750052396309024.jpgnewop_ccd4dde1-1889-404e-9b04-9471e5910511.jpg?v=1709373873"", ""https://sehgalmotors.pk/cdn/shop/products/gc5_20_1_.jpgnewop_d32c27fe-44a9-4de2-bfa6-0dd0e4717b2e.jpg?v=1709373873"", ""https://sehgalmotors.pk/cdn/shop/products/637064204419195466.jpgnewop_269e3206-adfc-4d59-9660-1388fb7d9746.jpg?v=1709373873"", ""https://sehgalmotors.pk/cdn/shop/products/gc2_20_1_.jpgnewop_37d01cf4-a1fc-4743-9dca-23f7df0409e2.jpg?v=1709373873"", ""https://sehgalmotors.pk/cdn/shop/products/637219641135157123.jpgnewop_86268c1f-b1d7-4302-9e8d-fd82e4c19efa.jpg?v=1709373873"", ""https://sehgalmotors.pk/cdn/shop/products/gc6_20_1_.jpgnewop_97ae7fc8-8e36-45dc-9f2f-41aa2e806d68.jpg?v=1709373873""]","[""-""]","-","interior",0,0,0
"Universal TYPE R Style Armrest - Center Console Storage Box | Center Console","Universal TYPE R Style Armrest ","parts","-",1500.0,500,"[""https://sehgalmotors.pk/cdn/shop/files/Universal-TYPE-R-Style-Armrest-Center-Console-Storage-Box-Center-Console-SehgalMotors-pk-8823.jpg?v=1707968455"", ""https://sehgalmotors.pk/cdn/shop/files/Universal-TYPE-R-Style-Armrest-Center-Console-Storage-Box-Center-Console-SehgalMotors-pk-5284.jpg?v=1707968458"", ""https://sehgalmotors.pk/cdn/shop/files/Universal-TYPE-R-Style-Armrest-Center-Console-Storage-Box-Center-Console-SehgalMotors-pk-7275.jpg?v=1707968462"", ""https://sehgalmotors.pk/cdn/shop/files/Universal-TYPE-R-Style-Armrest-Center-Console-Storage-Box-Center-Console-SehgalMotors-pk-2031.jpg?v=1707968465""]","[""-""]","-","interior",0,0,0
"Solar Powered Moving Flower Car Dashboard Decor Each - Multi","Solar Powered Moving Flower Car Dashboard Decor Each - Multi ","parts","-",350.0,500,"[""https://sehgalmotors.pk/cdn/shop/files/Solar-Powered-Moving-Flower-Car-Dashboard-Decor-Each-Multi-SehgalMotors-pk-5522.jpg?v=1707931613"", ""https://sehgalmotors.pk/cdn/shop/files/Solar-Powered-Moving-Flower-Car-Dashboard-Decor-Each-Multi-SehgalMotors-pk-3435.jpg?v=1707931616""]","[""-""]","-","interior",0,0,0
"Toyota Yaris Foldable & Flexible Side Sunshade With Logo - Model 2020-2021 - Sun Shade | Parda","Toyota Yaris Foldable Flexible Sunshade / Sun Shades With Logo - Model 2020-2021     ","parts","-",1000.0,500,"[""https://sehgalmotors.pk/cdn/shop/files/637528962756170245.jpgnewop.jpg?v=1715763351""]","[""-""]","-","interior",0,0,0
"Toyota Corolla Dashboard Carpet Velvet For Protection and Heat Resistance - Model 2014-2022","If youre looking for a way to protect your Toyota Corollas dashboard and add some heat resistance, consider using a velvet dashboard carpet. This type of carpet can be a great investment for your car, as it can protect the dashboard from harmful UV rays and extreme temperatures. The velvet dashboard carpet is made of a soft and plush material that feels great to the touch. It is also designed to be durable and long-lasting, ensuring that it will stay in place and protect your dashboard for years to come. Not only does the velvet dashboard carpet provide protection and heat resistance, but it can also enhance the appearance of your cars interior. It comes in a variety of colors and styles, so you can choose one that matches your personal taste and the color of your cars interior. ","parts","-",2500.0,500,"[""https://sehgalmotors.pk/cdn/shop/products/1698742775027175.jpg?v=1709197848"", ""https://sehgalmotors.pk/cdn/shop/products/637789765491713100.837.jpgnewop.jpg?v=1709197848""]","[""-""]","-","interior",0,0,0
"Neck Rest Pillow With Ear Phones 2 In 1 Multi Colors","Are you tired of restless journeys or struggling to find tranquility in your downtime? Look no further! Introducing our revolutionary 2-in-1 Multi-Color Neck Rest Pillow with Earphones. Designed to provide superior comfort and immersive audio experience, this innovative product is a must-have for anyone seeking ultimate relaxation. Unparalleled Comfort: Our neck rest pillow is ergonomically designed to conform to the natural curvature of your neck, providing optimal support and relieving strain. The premium-quality memory foam ensures exceptional comfort, allowing you to rest peacefully during long trips or while lounging at home. The pillows soft and breathable fabric cover adds an extra touch of luxury, while its multi-color options allow you to choose a style that suits your taste. Immersive Sound Experience: Indulge in your favorite music, audiobooks, or podcasts with the built-in earphones. The high-quality speakers deliver crystal-clear sound, enveloping you in an immersive audio experience. Simply connect your device to the pillows integrated audio jack, and enjoy hours of uninterrupted entertainment without the hassle of tangled wires. Versatile and Portable: This 2-in-1 neck rest pillow with earphones is perfect for various scenarios. Whether youre traveling by plane, train, or car, or simply unwinding at home, it provides exceptional support and entertainment. Its lightweight and compact design make it easy to carry in your luggage or backpack, ensuring you can take it anywhere and enjoy its benefits wherever you go. Easy Maintenance: We understand the importance of hassle-free maintenance. The pillows removable cover is machine washable, allowing you to keep it clean and fresh for extended use. Additionally, the durable materials used in its construction ensure long-lasting performance, so you can enjoy the products benefits for years to come. Thoughtful Gift Idea: Looking for a thoughtful gift for your loved ones? Our 2-in-1 Multi-Color Neck Rest Pillow with Earphones makes an excellent choice. It combines comfort, functionality, and style, making it a perfect gift for frequent travelers, students, or anyone in need of relaxation and entertainment.  ","parts","-",500.0,500,"[""https://sehgalmotors.pk/cdn/shop/files/Neck-Rest-Pillow-With-Ear-Phones-2-In-1-Multi-Colors-SehgalMotors-pk-4277.jpg?v=1707923521"", ""https://sehgalmotors.pk/cdn/shop/files/Neck-Rest-Pillow-With-Ear-Phones-2-In-1-Multi-Colors-SehgalMotors-pk-7416.jpg?v=1707923526"", ""https://sehgalmotors.pk/cdn/shop/files/Neck-Rest-Pillow-With-Ear-Phones-2-In-1-Multi-Colors-SehgalMotors-pk-8394.jpg?v=1707923529""]","[""-""]","-","interior",0,0,0
"Car Ashtray Smokeless Vehicle Ashtray Multi Color - Stainless With Lid Auto LED Light Indicator","Car Ashtray Smokeless Vehicle Ashtray Multi Color  ","parts","-",1000.0,500,"[""https://sehgalmotors.pk/cdn/shop/files/Car-Ashtray-Smokeless-Vehicle-Ashtray-Multi-Color-Stainless-With-Lid-Auto-LED-Light-Indicator-SehgalMotors-pk-9450.jpg?v=1707866430"", ""https://sehgalmotors.pk/cdn/shop/files/Car-Ashtray-Smokeless-Vehicle-Ashtray-Multi-Color-Stainless-With-Lid-Auto-LED-Light-Indicator-SehgalMotors-pk-6697.jpg?v=1707866433"", ""https://sehgalmotors.pk/cdn/shop/files/Car-Ashtray-Smokeless-Vehicle-Ashtray-Multi-Color-Stainless-With-Lid-Auto-LED-Light-Indicator-SehgalMotors-pk-7072.jpg?v=1707866436""]","[""-""]","-","interior",0,0,0
"Car Back Seat Air Inflatable Mattress Portable Bed Grey","Car Back Seat Air Mattress Grey;| Inflatable Backseat Bed ;;;;;;;;;;;;Air Mattress;serves the purposes of a usual mattress or bed, except that its mainly used in the car but can also be used for other general usages. Its a great product for people who go for long drives or road trips and can also be useful for any car driver who gets tired and decides to rest in the car! Order now at;SehgalMotors.PK. A;Car Mattress, otherwise called an airbed or a;blow-up;bed, is an inflatable sleeping cushion made of polyvinyl chloride (PVC) or material of plastic or elastic. The flattened;sleeping bed;can be compacted and conveyed or put away in a little structure. They are swelled either by blowing into a valve, with a manual or electric pump. Some are naturally expanded when a valve is opened, up to a specific weight with extra expansion physically or by the pump.;Car Bed cushions;are utilized for outdoors, transitory or full-time home use, and possibly streamlined to consolidate a few uses (e.g., outdoors and visitor use) while others are the single reason. Inflatable cushions may have tweaked shapes, for instance, wheel patterns for use in the freight zone of a pickup truck or SUV.;Dozing cushions;are lightweight, diminished size and decreased thickness;Changeless air beds;will look practically like customary beds. The immovability can be balanced up or down, with the basic push of a catch, on the remote. You can buy it from our outlet and from our store which is;SehgalMotors.PK.    ","parts","-",4700.0,500,"[""https://sehgalmotors.pk/cdn/shop/files/Car-Back-Seat-Air-Inflatable-Mattress-Portable-Bed-Grey-SehgalMotors-pk-8715.jpg?v=1707866660"", ""https://sehgalmotors.pk/cdn/shop/files/Car-Back-Seat-Air-Inflatable-Mattress-Portable-Bed-Grey-SehgalMotors-pk-4901.jpg?v=1707866663"", ""https://sehgalmotors.pk/cdn/shop/files/Car-Back-Seat-Air-Inflatable-Mattress-Portable-Bed-Grey-SehgalMotors-pk-6773.jpg?v=1707866666""]","[""-""]","-","interior",0,0,0
"Suzuki Mehran Foldable & Flexible Side Sunshade With Logo - Model 2012-2017 - Sun Shade | Parda","Suzuki Mehran Side Sunshade / Sun Shades with Logo - Model 2012-2017 On a hot, sunny day your car absorbs so much heat. It’s not only unpleasant but also causes various kinds of discomforts, from sizzling hot car doors and handles to breathing vexation. The solution? Well, you might ask, is this very product. “Suzuki Mehran Side Sunshade”. It’s of a type of material with a certain level of transparency so as not to cause any aggravated visual discomfort. After attaching your product to your cars side screen, you can expect to return to a vehicle that hasnt been overheated. This product is also known as (Shoji PVC Screen, Vent PVC Screen, Car Shade, Corolla Shades, and Toyota Shades) Believe it or not, car sun shades have quite a few different benefits. If you’ve ever left your vehicle directly in the sun, windows without any kind of tint, you’ll know what it’s like to drive your vehicle, it will be quite a challenge. What if you could do something about it, something that is very cheap and can actually, in the long run, save your interior from dry rotting and save you from getting baked in the heat? My friend, they are called windshield sunshades and, car side window sunshades. They may vary in size and shape, but they all serve one main purpose; to block (or drastically reduce), direct sunlight from entering your vehicle. To make your life MUCH easier, we put together a list of the best car window Curtains and driver side window sun visor. By no means are they perfect, but from hundreds and thousands of satisfied users, you can’t go wrong. You can get all these sun shades from our outlets and from our online stores so rush on to SehgalMotors.Pk. ; ","parts","-",1000.0,500,"[""https://sehgalmotors.pk/cdn/shop/files/636531850772578315.jpgnewop_e77fd2eb-81d3-408d-b044-1502851ba0b6.jpg?v=1715681003""]","[""-""]","-","interior",0,0,0
"Back Seat Organizer Car Caddy in Leather Black - Universal Storage Pockets Bag","Back Seat Organizer Car Caddy in Leather Black Everyone loves a bit of creativity and artistic endeavours. And theres no canvas better than your own car, to show your artistic capabilities. There are some gadgets in the car that keeps the car protected from inside.; All these gadgets are very helpful in keeping the car secure and protective of any destruction or dent from inside your car. There are many of the useful and beneficial products that not only protect your car’s body but also give your car an attractive and cool look. SehgalMotors.PK presenting you the best quality and very uniquely designed Interior protection gadgets. These products are made of high-quality metal with having attractive colours like black. SehgalMotors.PK Products are 100% original, guaranteed, having high-quality standards with money back Guarantee along with authentic and reliable products. Arrays of products that have the best results are available at us. Whenever you enter your car with a lot of stuff, you wish there was more space to organize your things. Lack of space leads to commotion in the car. The Back Seat Organizer Car Caddy in Leather Black is a product for both everyday items that you like to keep in the car, or the best organizer to place your snacks in, for a road trip. Another amazing thing about this product is that it comes in luxurious black leather to beautify your car. Also known as (Multi-purpose Organizer) ","parts","-",1200.0,500,"[""https://sehgalmotors.pk/cdn/shop/files/Back-Seat-Organizer-Car-Caddy-in-Leather-Black-Universal-Storage-Pockets-Bag-SehgalMotors-pk-783.jpg?v=1707867880""]","[""-""]","-","interior",0,0,0
